{"schemaVersion":"1.0.0","claim":"explicit-terminal-confirmation","batchId":"BR-900-rehearsal","fingerprint":"4b4c807c88c2ece00291fda87a18cb425111101c21ac5cd4662067e609597046","manifestSha256":"e19127d8f1b51602a30d9b169ae027237ca8346f2ae8036aa3be49a47ba607ac","sources":[{"path":"specs/features/greeting/spec.md","sha256":"8847ec2ed99f127c9582208823628903fc09280b8d39afa9e71a180d143792bc"},{"path":"specs/stories/FX-001-greet-function/acceptance.md","sha256":"fa93090bf6bbaccc50f615ec37f5f13e45fc6141df453933582616bd0ca4abb6"},{"path":"specs/stories/FX-001-greet-function/readiness.json","sha256":"d6a4b938b7eb6a671041f60534ca1a427735457e73b682a38f236e9c336f016a"},{"path":"specs/stories/FX-001-greet-function/story.md","sha256":"b3c79bf029fde2ae865aac8ec996315c7f034c8c789a788e157b41d40abed56f"},{"path":"specs/stories/FX-002-greet-test/acceptance.md","sha256":"81ec7a87da069f5a263a7646f8f7c1a3832ca9f63ea05547a4a0eee3e8574c3e"},{"path":"specs/stories/FX-002-greet-test/readiness.json","sha256":"841f07d605e41686671b35f3da82fe966d62f7fa922c95b3a0a7f52a9fbecfdc"},{"path":"specs/stories/FX-002-greet-test/story.md","sha256":"11757aaebde7cd1af21236434b39001790b564e8e4de8b7cf0a3121c2c519362"},{"path":"specs/stories/FX-003-greet-readme/acceptance.md","sha256":"4773eaa52b1c34b41c05107d1eb9acfa794a0efe2210d46d22e998d7dddf0d89"},{"path":"specs/stories/FX-003-greet-readme/readiness.json","sha256":"668477ff1734e669b6ffb81f58c6e482707336af86ff6dedaeb37910ceb523ad"},{"path":"specs/stories/FX-003-greet-readme/story.md","sha256":"6ff08b8f35a4d089814c1e25a6b42b395e7e6b10949ad7a439c34d1bdaf1ecec"}],"confirmedAt":"2026-09-24T14:11:43.516Z","deferred":[],"revisionSheets":[]}